{
  "$schema": "https://learnhns.com/schemas/activate-proposal-v1.schema.json",
  "kind": "activate-proposal",
  "version": 1,
  "source": {
    "application": "learnhns-web",
    "origin": "https://learnhns.com/activate/",
    "generatedAt": "2026-08-18T00:00:00.000Z"
  },
  "target": {
    "name": "example",
    "network": "main",
    "publishingLayer": "handshake-onchain"
  },
  "canonicalResource": {
    "source": "handshake-chain",
    "encoding": "hex",
    "value": "00",
    "requirement": "exact-match"
  },
  "operations": [
    { "op": "set-address", "recordType": "SYNTH4", "value": "203.0.113.8" },
    { "op": "set-address", "recordType": "SYNTH6", "value": "2001:db8::8" }
  ],
  "preservation": { "strategy": "preserve-unmentioned" }
}
